Julia Version 1.4.0
Commit b8e9a9ecc6 (2020-03-21 16:36 UTC)
Platform Info:
  OS: Linux (x86_64-pc-linux-gnu)
  CPU: AMD Ryzen Threadripper 2990WX 32-Core Processor
  WORD_SIZE: 64
  LIBM: libopenlibm
  LLVM: libLLVM-8.0.1 (ORCJIT, znver1)
Environment:
  JULIA_DEPOT_PATH = ::/usr/local/share/julia
  JULIA_NUM_THREADS = 2

  Resolving package versions...
  Installed Reexport ───────────────────── v0.2.0
  Installed MKL_jll ────────────────────── v2019.0.117+2
  Installed RecipesBase ────────────────── v0.8.0
  Installed SignalOperators ────────────── v0.4.0
  Installed SpecialFunctions ───────────── v0.10.0
  Installed IterTools ──────────────────── v1.3.0
  Installed Requires ───────────────────── v0.5.2
  Installed Unitful ────────────────────── v0.18.0
  Installed FillArrays ─────────────────── v0.8.7
  Installed MacroTools ─────────────────── v0.5.5
  Installed ConstructionBase ───────────── v1.0.0
  Installed FileIO ─────────────────────── v1.2.4
  Installed Compat ─────────────────────── v2.2.0
  Installed LambdaFn ───────────────────── v0.3.0
  Installed FFTW_jll ───────────────────── v3.3.9+5
  Installed CompilerSupportLibraries_jll ─ v0.3.3+0
  Installed SignalBase ─────────────────── v0.1.1
  Installed DSP ────────────────────────── v0.6.3
  Installed MetaArrays ─────────────────── v0.2.7
  Installed AbstractFFTs ───────────────── v0.5.0
  Installed Polynomials ────────────────── v0.6.1
  Installed OpenSpecFun_jll ────────────── v0.5.3+3
  Installed PrettyPrinting ─────────────── v0.2.0
  Installed IntelOpenMP_jll ────────────── v2018.0.3+0
  Installed FFTW ───────────────────────── v1.2.0
   Updating `~/.julia/environments/v1.4/Project.toml`
  [4d633899] + SignalOperators v0.4.0
   Updating `~/.julia/environments/v1.4/Manifest.toml`
  [621f4979] + AbstractFFTs v0.5.0
  [34da2185] + Compat v2.2.0
  [e66e0078] + CompilerSupportLibraries_jll v0.3.3+0
  [187b0558] + ConstructionBase v1.0.0
  [717857b8] + DSP v0.6.3
  [7a1cc6ca] + FFTW v1.2.0
  [f5851436] + FFTW_jll v3.3.9+5
  [5789e2e9] + FileIO v1.2.4
  [1a297f60] + FillArrays v0.8.7
  [1d5cc7b8] + IntelOpenMP_jll v2018.0.3+0
  [c8e1da08] + IterTools v1.3.0
  [fcefd6c4] + LambdaFn v0.3.0
  [856f044c] + MKL_jll v2019.0.117+2
  [1914dd2f] + MacroTools v0.5.5
  [36b8f3f0] + MetaArrays v0.2.7
  [efe28fd5] + OpenSpecFun_jll v0.5.3+3
  [f27b6e38] + Polynomials v0.6.1
  [54e16d92] + PrettyPrinting v0.2.0
  [3cdcf5f2] + RecipesBase v0.8.0
  [189a3867] + Reexport v0.2.0
  [ae029012] + Requires v0.5.2
  [00c44e92] + SignalBase v0.1.1
  [4d633899] + SignalOperators v0.4.0
  [276daf66] + SpecialFunctions v0.10.0
  [1986cc42] + Unitful v0.18.0
  [2a0f44e3] + Base64 
  [ade2ca70] + Dates 
  [8bb1440f] + DelimitedFiles 
  [8ba89e20] + Distributed 
  [b77e0a4c] + InteractiveUtils 
  [76f85450] + LibGit2 
  [8f399da3] + Libdl 
  [37e2e46d] + LinearAlgebra 
  [56ddb016] + Logging 
  [d6f4376e] + Markdown 
  [a63ad114] + Mmap 
  [44cfe95a] + Pkg 
  [de0858da] + Printf 
  [3fa0cd96] + REPL 
  [9a3f8284] + Random 
  [ea8e919c] + SHA 
  [9e88b42a] + Serialization 
  [1a1011a3] + SharedArrays 
  [6462fe0b] + Sockets 
  [2f01184e] + SparseArrays 
  [10745b16] + Statistics 
  [8dfed614] + Test 
  [cf7118a7] + UUIDs 
  [4ec0a83e] + Unicode 
   Building FFTW → `~/.julia/packages/FFTW/qqcBj/deps/build.log`
    Testing SignalOperators
Status `/tmp/jl_33Mnjw/Manifest.toml`
  [621f4979] AbstractFFTs v0.5.0
  [39de3d68] AxisArrays v0.4.2
  [6e4b80f9] BenchmarkTools v0.5.0
  [34da2185] Compat v2.2.0
  [e66e0078] CompilerSupportLibraries_jll v0.3.3+0
  [187b0558] ConstructionBase v1.0.0
  [717857b8] DSP v0.6.3
  [0703355e] DimensionalData v0.10.1
  [da5c29d0] EllipsisNotation v0.4.0
  [7a1cc6ca] FFTW v1.2.0
  [f5851436] FFTW_jll v3.3.9+5
  [5789e2e9] FileIO v1.2.4
  [1a297f60] FillArrays v0.8.7
  [53c48c17] FixedPointNumbers v0.8.0
  [1d5cc7b8] IntelOpenMP_jll v2018.0.3+0
  [8197267c] IntervalSets v0.4.0
  [c8e1da08] IterTools v1.3.0
  [682c06a0] JSON v0.21.0
  [fcefd6c4] LambdaFn v0.3.0
  [856f044c] MKL_jll v2019.0.117+2
  [1914dd2f] MacroTools v0.5.5
  [36b8f3f0] MetaArrays v0.2.7
  [efe28fd5] OpenSpecFun_jll v0.5.3+3
  [69de0a69] Parsers v1.0.1
  [f27b6e38] Polynomials v0.6.1
  [54e16d92] PrettyPrinting v0.2.0
  [92933f4c] ProgressMeter v1.2.0
  [b3c3ace0] RangeArrays v0.3.2
  [3cdcf5f2] RecipesBase v0.8.0
  [189a3867] Reexport v0.2.0
  [ae029012] Requires v0.5.2
  [00c44e92] SignalBase v0.1.1
  [4d633899] SignalOperators v0.4.0
  [276daf66] SpecialFunctions v0.10.0
  [1986cc42] Unitful v0.18.0
  [8149f6b0] WAV v1.0.3
  [2a0f44e3] Base64 
  [ade2ca70] Dates 
  [8bb1440f] DelimitedFiles 
  [8ba89e20] Distributed 
  [b77e0a4c] InteractiveUtils 
  [76f85450] LibGit2 
  [8f399da3] Libdl 
  [37e2e46d] LinearAlgebra 
  [56ddb016] Logging 
  [d6f4376e] Markdown 
  [a63ad114] Mmap 
  [44cfe95a] Pkg 
  [de0858da] Printf 
  [3fa0cd96] REPL 
  [9a3f8284] Random 
  [ea8e919c] SHA 
  [9e88b42a] Serialization 
  [1a1011a3] SharedArrays 
  [6462fe0b] Sockets 
  [2f01184e] SparseArrays 
  [10745b16] Statistics 
  [8dfed614] Test 
  [cf7118a7] UUIDs 
  [4ec0a83e] Unicode 
WARNING: Method definition identify(DimensionalData.AutoSpan, Type, Base.AbstractRange{T} where T) in module DimensionalData at /home/pkgeval/.julia/packages/DimensionalData/cPxAn/src/mode.jl:441 overwritten at /home/pkgeval/.julia/packages/DimensionalData/cPxAn/src/mode.jl:443.
  ** incremental compilation may be fatally broken for this module **

Running tests...  3%|█                                  |  ETA: 0:02:59[KRunning tests...  6%|██▁                                |  ETA: 0:02:50[KRunning tests...  9%|███▁                               |  ETA: 0:02:43[KRunning tests... 12%|████▁                              |  ETA: 0:02:46[KRunning tests... 15%|█████▁                             |  ETA: 0:02:10[KRunning tests... 18%|██████▁                            |  ETA: 0:02:07[KRunning tests... 21%|███████▁                           |  ETA: 0:02:01[KRunning tests... 24%|████████▌                          |  ETA: 0:02:22[KRunning tests... 27%|█████████▌                         |  ETA: 0:03:07[KRunning tests... 30%|██████████▋                        |  ETA: 0:03:15[KRunning tests... 33%|███████████▋                       |  ETA: 0:02:59[KRunning tests... 36%|████████████▊                      |  ETA: 0:02:58[KRunning tests... 39%|█████████████▊                     |  ETA: 0:03:16[KRunning tests... 42%|██████████████▉                    |  ETA: 0:04:03[KRunning tests... 45%|███████████████▉                   |  ETA: 0:03:44[KRunning tests... 48%|█████████████████                  |  ETA: 0:03:26[KRunning tests... 52%|██████████████████                 |  ETA: 0:03:12[KRunning tests... 55%|███████████████████▁               |  ETA: 0:02:51[KRunning tests... 58%|████████████████████▁              |  ETA: 0:02:38[KRunning tests... 61%|█████████████████████▁             |  ETA: 0:02:34[KRunning tests... 64%|██████████████████████▁            |  ETA: 0:02:18[KRunning tests... 67%|███████████████████████▁           |  ETA: 0:02:01[KRunning tests... 70%|████████████████████████▁          |  ETA: 0:01:54[KRunning tests... 73%|█████████████████████████▌         |  ETA: 0:01:43[KRunning tests... 76%|██████████████████████████▌        |  ETA: 0:01:39[KRunning tests... 79%|███████████████████████████▋       |  ETA: 0:01:32[KRunning tests... 82%|████████████████████████████▋      |  ETA: 0:01:23[KRunning tests... 85%|█████████████████████████████▊     |  ETA: 0:01:10[KRunning tests... 88%|██████████████████████████████▊    |  ETA: 0:01:04[KRunning tests... 91%|███████████████████████████████▉   |  ETA: 0:00:53[KRunning tests... 94%|████████████████████████████████▉  |  ETA: 0:00:35[K Activating new environment at `~/.julia/packages/SignalOperators/VmWyE/test/jl_Ecf2Nr/Project.toml`
  Resolving package versions...
  Installed TreeViews ───────── v0.3.0
  Installed libsndfile_jll ──── v1.0.28+1
  Installed libvorbis_jll ───── v1.3.6+2
  Installed FLAC_jll ────────── v1.3.3+1
  Installed LibSndFile ──────── v2.3.0
  Installed Unitful ─────────── v0.17.0
  Installed FixedPointNumbers ─ v0.6.1
  Installed SampledSignals ──── v2.1.0
  Installed Ogg_jll ─────────── v1.3.3+0
  Installed IntervalSets ────── v0.3.2
   Updating `~/.julia/packages/SignalOperators/VmWyE/test/jl_Ecf2Nr/Project.toml`
  [b13ce0c6] + LibSndFile v2.3.0
   Updating `~/.julia/packages/SignalOperators/VmWyE/test/jl_Ecf2Nr/Manifest.toml`
  [621f4979] + AbstractFFTs v0.5.0
  [34da2185] + Compat v2.2.0
  [e66e0078] + CompilerSupportLibraries_jll v0.3.3+0
  [717857b8] + DSP v0.6.3
  [7a1cc6ca] + FFTW v1.2.0
  [f5851436] + FFTW_jll v3.3.9+5
  [1d38b3a6] + FLAC_jll v1.3.3+1
  [5789e2e9] + FileIO v1.2.4
  [53c48c17] + FixedPointNumbers v0.6.1
  [1d5cc7b8] + IntelOpenMP_jll v2018.0.3+0
  [8197267c] + IntervalSets v0.3.2
  [c8e1da08] + IterTools v1.3.0
  [b13ce0c6] + LibSndFile v2.3.0
  [856f044c] + MKL_jll v2019.0.117+2
  [e7412a2a] + Ogg_jll v1.3.3+0
  [efe28fd5] + OpenSpecFun_jll v0.5.3+3
  [f27b6e38] + Polynomials v0.6.1
  [3cdcf5f2] + RecipesBase v0.8.0
  [189a3867] + Reexport v0.2.0
  [bd7594eb] + SampledSignals v2.1.0
  [276daf66] + SpecialFunctions v0.10.0
  [a2a6695c] + TreeViews v0.3.0
  [1986cc42] + Unitful v0.17.0
  [5bf562c0] + libsndfile_jll v1.0.28+1
  [f27f6e37] + libvorbis_jll v1.3.6+2
  [2a0f44e3] + Base64 
  [ade2ca70] + Dates 
  [8bb1440f] + DelimitedFiles 
  [8ba89e20] + Distributed 
  [b77e0a4c] + InteractiveUtils 
  [76f85450] + LibGit2 
  [8f399da3] + Libdl 
  [37e2e46d] + LinearAlgebra 
  [56ddb016] + Logging 
  [d6f4376e] + Markdown 
  [a63ad114] + Mmap 
  [44cfe95a] + Pkg 
  [de0858da] + Printf 
  [3fa0cd96] + REPL 
  [9a3f8284] + Random 
  [ea8e919c] + SHA 
  [9e88b42a] + Serialization 
  [1a1011a3] + SharedArrays 
  [6462fe0b] + Sockets 
  [2f01184e] + SparseArrays 
  [10745b16] + Statistics 
  [8dfed614] + Test 
  [cf7118a7] + UUIDs 
  [4ec0a83e] + Unicode 
  Resolving package versions...
   Updating `~/.julia/packages/SignalOperators/VmWyE/test/jl_Ecf2Nr/Project.toml`
  [bd7594eb] + SampledSignals v2.1.0
   Updating `~/.julia/packages/SignalOperators/VmWyE/test/jl_Ecf2Nr/Manifest.toml`
 [no changes]
[ Info: Loading LibSndFile backend for SignalOperators.
Running tests... 97%|██████████████████████████████████ |  ETA: 0:00:18[KRunning tests...100%|███████████████████████████████████| Time: 0:10:04[K
Test Summary:      | Pass  Total
SignalOperators.jl |  483    483
    Testing SignalOperators tests passed 
